{"schemaVersion":1,"gameVersion":"0.2.6403.27689","networks":[{"id":"shared","kind":"cable","cableRole":"powerAndData"}],"devices":[{"id":"publisher","prefab":"StructureCircuitHousing","connections":{"0":"shared","1":"shared"},"ic":{"program":"publisher.ic10","pins":{"d0":"published-value"}}},{"id":"subscriber","prefab":"StructureCircuitHousing","connections":{"0":"shared","1":"shared"},"ic":{"program":"subscriber.ic10","pins":{"d0":"received-value"}}},{"id":"published-value","prefab":"StructureLogicMemory","connections":{"0":"shared"},"fields":{"Setting":42}},{"id":"received-value","prefab":"StructureLogicMemory","connections":{"0":"shared"},"fields":{"Setting":0}}]}
