{"schemaVersion":1,"gameVersion":"0.2.6403.27689","networks":[{"id":"data","kind":"cable","cableRole":"data"},{"id":"power","kind":"cable","cableRole":"power"},{"id":"input","kind":"gas"},{"id":"output","kind":"gas"},{"id":"waste","kind":"gas"}],"devices":[{"id":"controller","prefab":"StructureCircuitHousing","connections":{"0":"data","1":"power"},"ic":{"program":"filtration.ic10","pins":{"d0":"gas-sensor","d1":"filtration-unit"}}},{"id":"gas-sensor","prefab":"StructureGasSensor","connections":{"0":"data"},"fields":{"RatioPollutant":0}},{"id":"filtration-unit","prefab":"StructureFiltration","connections":{"0":"data","1":"input","2":"output","3":"waste","4":"power"},"fields":{"On":0}}]}
