{"schemaVersion":1,"gameVersion":"0.2.6403.27689","networks":[{"id":"data","kind":"cable","cableRole":"data"},{"id":"power","kind":"cable","cableRole":"power"}],"devices":[{"id":"controller","prefab":"StructureCircuitHousing","connections":{"0":"data","1":"power"},"ic":{"program":"airlock.ic10","pins":{"d0":"chamber-sensor","d1":"exterior-door","d2":"interior-door"}}},{"id":"chamber-sensor","prefab":"StructureGasSensor","connections":{"0":"data"},"fields":{"Pressure":101}},{"id":"exterior-door","prefab":"StructureGlassDoor","connections":{"0":"data","1":"power"},"fields":{"Open":0,"On":1}},{"id":"interior-door","prefab":"StructureGlassDoor","connections":{"0":"data","1":"power"},"fields":{"Open":1,"On":1}}]}
